Offset,Hash,Original,Translation
61,0,"@MYNAME様、
ようこそおいで下さいましたニャ。","@MYNAME님,
잘 오셨다냥."
127,1,"レジェンドラスタのフローラが
大事な話があるとかで来ておりますニャ。","레전드 라스터인 플로라가
중요한 이야기가 있다면서 와 있습니다냥."
223,2,"@MYNAMEさん！
た、助けてくださいっ！","@MYNAME씨!
도, 도와주세요!"
281,3,"ニャ、ニャンですかいきなり。
落ち着いて話さなければ、
ニャにがニャンだかわからニャいですニャ！","냐, 냥이라니 갑자기 왜 그러시나요.
차분히 말씀하지 않으면,
뭐가 뭔지 모르겠습니다냥!"
405,4,"ご、ごめんなさい。
実は…アタシのパートニャーが、
病気になってしまったんです！","죄, 죄송해요.
실은…제 파트냐가,
병에 걸려버렸어요!"
513,5,パートニャーが病気…？,파트냐가 병에…?
556,6,"そりゃあ、ネコと一緒に暮していれば
病気になることぐらいありますニャ。
いったい、ニャンの病気ですかニャ？","그야, 아이루와 함께 살다 보면
병에 걸릴 수도 있습니다냥.
대체, 무슨 병인가요냥?"
683,7,それがわからないから困ってるんです！,그걸 몰라서 곤란한 거예요!
740,8,"最初は、少し元気や食欲がないから、
狩りの疲れかなって思ってたんですけど…","처음에는, 조금 기운이나 식욕이 없어서,
사냥 피로인가 했는데요…"
835,9,"そのうち体温が下がってきて…
寒い寒いと震えて、眠気を訴え…
とうとう昨夜、倒れてしまったんです！","그러다 체온이 내려가더니…
춥다 춥다며 떨고, 졸음을 호소하다가…
결국 어젯밤, 쓰러지고 말았어요!"
954,10,"そ、それは一大事ですニャ！
すぐに医者に見せた方がいいですニャ！","그, 그건 큰일입니다냥!
당장 의사에게 보이는 게 좋겠습니다냥!"
1039,11,"もちろんすぐに見せました！
でも、原因はわからないって…","물론 바로 보였어요!
그런데, 원인은 모르겠다고…"
1116,12,"今は少し落ち着いて眠ってるんですけど、
もうアタシ、心配で心配で…","지금은 조금 안정되어 자고 있는데,
저, 걱정돼서 걱정돼서…"
1203,13,"ヒエヒエドリンクを飲みすぎたとか、
クーラーミートを食べすぎた…
としても、そんな症状は出ませんニャぁ。","시원시원 드링크를 너무 많이 마셨다거나,
쿨러 미트를 너무 많이 먹었다고 해도…
그런 증상은 나오지 않습니다냥."
1328,14,"それ以外に、ニャにか変なモノでも
食わせたんじゃニャいのかニャ？","그 밖에, 뭔가 이상한 걸
먹인 거 아닌가요냥?"
1413,15,"それはないと思います。
アタシがあげる食べ物以外は食べちゃダメって
厳しく言ってますし…","그건 아닐 거예요.
제가 주는 음식 말고는 먹지 말라고
엄하게 일러뒀고…"
1522,16,"ユウェルさんがケーキを焼いたから
一緒に食べましょうって誘われた時も、
やんわりお断りしましたから…","유웰 씨가 케이크를 구웠다고
같이 먹자고 권했을 때도,
넌지시 거절했으니까요…"
1643,17,"それは大正解ニャ。
あのオンニャの怪しい料理を食べると
命にかかわるニャ！","그건 정답이다냥.
그 온냥의 수상한 요리를 먹으면
목숨이 위험하다냥!"
1738,18,"しかし、食べ物でニャいとすると、
モンスターとの攻防で、何らかの
毒などに侵されたのかもしれませんニャ。","하지만, 음식이 아니라고 하면,
몬스터와의 공방 중, 어떠한
독 같은 것에 당한 걸지도 모릅니다냥."
1863,19,"ええ、お医者さんにも
その可能性は高いって言われました。","네, 의사 선생님도
그 가능성이 높다고 하셨어요."
1940,20,"だけど、原因となるモンスターを
特定できない限り、対処できないって…","하지만, 원인이 되는 몬스터를
특정하지 못하는 한, 대처할 수 없다고…"
2029,21,"うーむ、困りましたニャぁ。
とにかく、うつる危険性もある以上、
他のネコや人との接触は厳禁ですニャ。","으음, 곤란하게 됐습니다냥.
아무튼, 옮을 위험성도 있는 이상,
다른 아이루나 사람과의 접촉은 금물입니다냥."
2150,22,"それと、症状から考えて
解毒効果の高い薬を与えてやらなければ
なりませんニャ。","그리고, 증상으로 보아
해독 효과가 높은 약을 먹여 줘야
합니다냥."
2249,23,"万病に効くとされる魚竜のキモと、
魚竜種の特濃血を混ぜ合わせて与えれば
ひとまずお腹の痛みは和らぐはずですニャ。","만병에 효과가 있다는 어룡 간과,
매우진한어룡종피를 섞어서 먹이면
일단 배 아픈 건 진정될 겁니다냥."
2382,24,"魚竜のキモと、魚竜種の特濃血ですね。
わかりました。","어룡 간과, 매우진한어룡종피이군요.
알겠습니다."
2455,25,"ただし、魚竜種の特濃血は
新鮮なモノを与えなければなりませんニャ。","단, 매우진한어룡종피는
신선한 것을 줘야만 합니다냥."
2549,26,"@MYNAMEさん、出番だぜニャ。
フローラのパートニャーのために、
ひと肌脱いでやろうぜニャ。","@MYNAME씨, 나설 차례다냥.
플로라의 파트냐를 위해,
한몫 거들어 주자냥."
2672,27,"@MYNAMEさん、
本当にいつもありがとうございます！","@MYNAME씨,
정말 늘 감사드려요!"
2742,28,"魚竜種の特濃血なら、
ヴォルガノス変種を狩るのが
手っ取り早いぜニャ。","매우진한어룡종피이라면,
볼가노스 변종을 사냥하는 게
제일 빠르다냥."
2833,29,"~C05総合クエスト受付~C00へ行けば、２人でも狩れる
比較的弱めのモンスターを案内してくれるから、
よろしく頼むぜニャ！","~C05종합 퀘스트 접수처~C00에 가면, 둘이서도 사냥할 수 있는
비교적 약한 몬스터를 안내해 주니까,
잘 부탁한다냥!"
2983,30,"フローラのパートニャーのために、
~C05総合クエスト受付~C00へ行って
ヴォルガノス変種を狩って欲しいニャ。","플로라의 파트냐를 위해,
~C05종합 퀘스트 접수처~C00에 가서
볼가노스 변종을 사냥해 줬으면 한다냥."
3108,31,"同じネコ同士、他人事ではないですニャ。
よろしくお願いしますニャ！","같은 아이루끼리, 남 일이 아닙니다냥.
잘 부탁드립니다냥!"
3197,32,"@MYNAME様、
おかえりなさいですニャ！
フローラが待っておりますニャ。","@MYNAME님,
어서 오세요냥!
플로라가 기다리고 있습니다냥."
3294,33,"@MYNAMEさん、ありがとうございました！
おかげ様で、パートニャーの症状も
少しは良くなったみたいです。","@MYNAME씨, 감사했습니다!
덕분에, 파트냐의 증상도
조금은 나아진 것 같아요."
3416,34,"しかし、今回の処置は
対症療法にすぎませんですニャ。
やはり、根本的な原因を調べニャいと…","하지만, 이번 처치는
대증요법에 불과합니다냥.
역시, 근본적인 원인을 조사해야…"
3527,35,"心当たりはないのかニャ？
狩りの最中にケガしたとか、
モンスターに引っかかれたとか…","짚이는 데는 없나요냥?
사냥 도중에 다쳤다거나,
몬스터한테 할퀴었다거나…"
3639,36,"うーん…思い当たるようなことは
特になにも…","음…딱히 짚이는 건
특별히 아무것도…"
3704,37,"仕方ニャいですニャ。
とりあえず今夜一晩は様子を見て、
ニャにかあればまた来てくださいニャ。","어쩔 수 없습니다냥.
일단 오늘 밤은 지켜보고,
뭔가 있으면 다시 와 주세요냥."
3824,38,"わかりました。
皆さん、本当にありがとうございました。","알겠습니다.
여러분, 정말 감사했습니다."
3947,39,"心配だニャぁ。
オイラたちも他人事ではないニャ。","걱정된다냥.
우리도 남 일이 아니다냥."
4016,40,"妙な流行り病でなければ
良いのですがニャ…","이상한 유행병이 아니면
좋겠는데요냥…"
4086,41,"オレたちも手洗いうがいを心掛けて、
拾い食いは絶対にしないことだぜニャ。
トッツイ、わかったかニャ！？","우리도 손 씻고 양치질 신경 쓰고,
주워 먹기는 절대 하지 말자냥.
톳츠이, 알았냐냥!?"
4209,42,"オ、オイラは拾い食いなんて
したことがないニャ！","나, 나는 주워 먹기 같은 거
한 적 없다냥!"
4278,43,お前が一番心配だぜニャ…,네가 제일 걱정된다냥…
